,url,title,date,text
602,https://vk.com/@evgenyponasenkov-1812-god-otvet-istorika-patriarhu-kirillu-10-01-2013?context=author_page_date&ref=author_page,1812 год: ответ историка Патриарху Кириллу (10. 01. 2013). Запись в ВК,2020-11-26,Они были «патриотами» даже в мелочах: в реестре князя (!)
603,https://vk.com/@evgenyponasenkov-1812-god-otvet-istorika-patriarhu-kirillu-10-01-2013?context=author_page_date&ref=author_page,1812 год: ответ историка Патриарху Кириллу (10. 01. 2013). Запись в ВК,2020-11-26,"Засекина, например, среди прочего перечисляются (с требованием к государству Российскому, к Руси-матушке это компенсировать): 4 кувшина для сливок, 2 «масляницы», чашка для бульона."
604,https://vk.com/@evgenyponasenkov-1812-god-otvet-istorika-patriarhu-kirillu-10-01-2013?context=author_page_date&ref=author_page,1812 год: ответ историка Патриарху Кириллу (10. 01. 2013). Запись в ВК,2020-11-26,Дочь бравого бригадира Артамонова пошла дальше: требовала «новые чулки и шемизетки».
605,https://vk.com/@evgenyponasenkov-1812-god-otvet-istorika-patriarhu-kirillu-10-01-2013?context=author_page_date&ref=author_page,1812 год: ответ историка Патриарху Кириллу (10. 01. 2013). Запись в ВК,2020-11-26,"Количество требований было столь огромным, что государство вскоре прекратило их принимать, тем более, что часто следствием выяснялось: вещи не погибли в пожаре и не были вывезены французами, а расхищены самими московскими жителями и православными подмосковными крестьянами (Мельгунов С.П. Александр I. М., 2010, с. 248)."
606,https://vk.com/@evgenyponasenkov-1812-god-otvet-istorika-patriarhu-kirillu-10-01-2013?context=author_page_date&ref=author_page,1812 год: ответ историка Патриарху Кириллу (10. 01. 2013). Запись в ВК,2020-11-26,Но не беда!
607,https://vk.com/@evgenyponasenkov-1812-god-otvet-istorika-patriarhu-kirillu-10-01-2013?context=author_page_date&ref=author_page,1812 год: ответ историка Патриарху Кириллу (10. 01. 2013). Запись в ВК,2020-11-26,Крестьяне оказались «достойны» своих недостойных хозяев.
608,https://vk.com/@evgenyponasenkov-1812-god-otvet-istorika-patriarhu-kirillu-10-01-2013?context=author_page_date&ref=author_page,1812 год: ответ историка Патриарху Кириллу (10. 01. 2013). Запись в ВК,2020-11-26,"В 1812 году они начали самую настоящую войну против православных помещиков, армии и государства (это официозные историки всегда замалчивали)."
609,https://vk.com/@evgenyponasenkov-1812-god-otvet-istorika-patriarhu-kirillu-10-01-2013?context=author_page_date&ref=author_page,1812 год: ответ историка Патриарху Кириллу (10. 01. 2013). Запись в ВК,2020-11-26,"К примеру, 28 (10) июля под местечком Голубичи вооруженные земледельцы напали на большой войсковой транспорт 1-й Западной армии М.Б. Барклая де Толли, захватили все повозки с вещами Каргопольского, Рыльского и Московского драгунских полков («Совершенно секретно»."
610,https://vk.com/@evgenyponasenkov-1812-god-otvet-istorika-patriarhu-kirillu-10-01-2013?context=author_page_date&ref=author_page,1812 год: ответ историка Патриарху Кириллу (10. 01. 2013). Запись в ВК,2020-11-26,"№ 8, 2012, с. 15-16)."
611,https://vk.com/@evgenyponasenkov-1812-god-otvet-istorika-patriarhu-kirillu-10-01-2013?context=author_page_date&ref=author_page,1812 год: ответ историка Патриарху Кириллу (10. 01. 2013). Запись в ВК,2020-11-26,"9 июля мужики деревни Томчино набросились на команду Белостокского внутреннего гарнизонного батальона, сопровождавшую транспорт с хирургическими инструментами, захватили пять унтер-офицеров, шесть рядовых и прапорщика (Там же, с. 16)."
612,https://vk.com/@evgenyponasenkov-1812-god-otvet-istorika-patriarhu-kirillu-10-01-2013?context=author_page_date&ref=author_page,1812 год: ответ историка Патриарху Кириллу (10. 01. 2013). Запись в ВК,2020-11-26,"В то же день у деревни Кацеле (в 18 верстах от Полоцка) вооруженные крестьяне захватили транспорт, следовавший под охраной прапорщика, семи унтер-офицеров и аж 18 рядовых (Там же)!"
613,https://vk.com/@evgenyponasenkov-1812-god-otvet-istorika-patriarhu-kirillu-10-01-2013?context=author_page_date&ref=author_page,1812 год: ответ историка Патриарху Кириллу (10. 01. 2013). Запись в ВК,2020-11-26,Подобные военные действия против «своих» стали нормой (подробнее о десятках похожих случаев в ходе всей войны – см.: Поликарпов Н.П. Боевой календарь-ежедневник Отечественной войны 1812 года).
614,https://vk.com/@evgenyponasenkov-1812-god-otvet-istorika-patriarhu-kirillu-10-01-2013?context=author_page_date&ref=author_page,1812 год: ответ историка Патриарху Кириллу (10. 01. 2013). Запись в ВК,2020-11-26,"Не будем забывать и о «духовности», которая зачастую подменятся дешевыми спекуляциями на темы веры и ее надсмотрщика - религии (сейчас это вообще модный тренд: раньше спрашивали партийную принадлежность, а сейчас конфессиональную)."
615,https://vk.com/@evgenyponasenkov-1812-god-otvet-istorika-patriarhu-kirillu-10-01-2013?context=author_page_date&ref=author_page,1812 год: ответ историка Патриарху Кириллу (10. 01. 2013). Запись в ВК,2020-11-26,"Прежде всего, напомню: именно русские из простонародья вызвались снять большой крест с колокольни Ивана Великого, который Наполеон, предположительно, собирался водрузить на Доме инвалидов в Париже (1812 год в воспоминаниях современников."
616,https://vk.com/@evgenyponasenkov-1812-god-otvet-istorika-patriarhu-kirillu-10-01-2013?context=author_page_date&ref=author_page,1812 год: ответ историка Патриарху Кириллу (10. 01. 2013). Запись в ВК,2020-11-26,М.: Наука.
617,https://vk.com/@evgenyponasenkov-1812-god-otvet-istorika-patriarhu-kirillu-10-01-2013?context=author_page_date&ref=author_page,1812 год: ответ историка Патриарху Кириллу (10. 01. 2013). Запись в ВК,2020-11-26,"1995, с. 169)."
618,https://vk.com/@evgenyponasenkov-1812-god-otvet-istorika-patriarhu-kirillu-10-01-2013?context=author_page_date&ref=author_page,1812 год: ответ историка Патриарху Кириллу (10. 01. 2013). Запись в ВК,2020-11-26,"И потомки таких русских уничтожали храмы после 1917 года: не французы из Антанты, не образованные атеисты из русских университетов – а простой люд, который воспитывали в атмосфере ненависти в церковно-приходских школах (среди выпускников, цитировавших Ветхий завет кусками наизусть, был и главный изверг прошлого века - Сталин)."
619,https://vk.com/@evgenyponasenkov-1812-god-otvet-istorika-patriarhu-kirillu-10-01-2013?context=author_page_date&ref=author_page,1812 год: ответ историка Патриарху Кириллу (10. 01. 2013). Запись в ВК,2020-11-26,"В эпоху 1812 года агрессивные и идеологизированные призывы православного Синода объективно вносили раскол в российское общество, которое было многоконфессиональным (значительная часть театра военных действий 1812 года была католической и протестантской), полиэтничным, а в среде господствующего класса уже почти не было верующих (из письма будущего автора сказки 1830 года «О попе и о его работнике Балде» Пушкина, Одесса, 1824 год: «Читаю Библию…, но предпочитаю Гете и Шекспира»)."
620,https://vk.com/@evgenyponasenkov-1812-god-otvet-istorika-patriarhu-kirillu-10-01-2013?context=author_page_date&ref=author_page,1812 год: ответ историка Патриарху Кириллу (10. 01. 2013). Запись в ВК,2020-11-26,"Многие просвещенные люди еще с восемнадцатого века предполагали, что православие свернуло Русь с пути развития европейской цивилизации в сторону темного византинизма, который долгие века был ступором развития общества (конкретнее всех эту идею сформулировал прототип Чацкого – П.Я. Чаадаев)."
621,https://vk.com/@evgenyponasenkov-1812-god-otvet-istorika-patriarhu-kirillu-10-01-2013?context=author_page_date&ref=author_page,1812 год: ответ историка Патриарху Кириллу (10. 01. 2013). Запись в ВК,2020-11-26,"Действительно, православный менталитет в лице фанатичных его адептов был страшно агрессивен по отношению к окружающим людям, и особенно – к братьям по христианской вере."
622,https://vk.com/@evgenyponasenkov-1812-god-otvet-istorika-patriarhu-kirillu-10-01-2013?context=author_page_date&ref=author_page,1812 год: ответ историка Патриарху Кириллу (10. 01. 2013). Запись в ВК,2020-11-26,"Вот, какие страшные (и противные духу заветов Христа) слова сказал публицист Н.И.Греч о неприятелях-турках и о соотечественниках (после присоединения Польских земель к России) поляках: «первые не христиане, последние и того хуже» (Греч Н.И. Записки о моей жизни."
623,https://vk.com/@evgenyponasenkov-1812-god-otvet-istorika-patriarhu-kirillu-10-01-2013?context=author_page_date&ref=author_page,1812 год: ответ историка Патриарху Кириллу (10. 01. 2013). Запись в ВК,2020-11-26,"М.,1990, с. 212)."
624,https://vk.com/@evgenyponasenkov-1812-god-otvet-istorika-patriarhu-kirillu-10-01-2013?context=author_page_date&ref=author_page,1812 год: ответ историка Патриарху Кириллу (10. 01. 2013). Запись в ВК,2020-11-26,"Мы и сегодня слышим от некоторых фанатиков постыдные речи о том, что, к примеру, «все католики попадут в ад»."
625,https://vk.com/@evgenyponasenkov-1812-god-otvet-istorika-patriarhu-kirillu-10-01-2013?context=author_page_date&ref=author_page,1812 год: ответ историка Патриарху Кириллу (10. 01. 2013). Запись в ВК,2020-11-26,Эхо подобного жанра войны звучит до сих пор…
626,https://vk.com/@evgenyponasenkov-1812-god-otvet-istorika-patriarhu-kirillu-10-01-2013?context=author_page_date&ref=author_page,1812 год: ответ историка Патриарху Кириллу (10. 01. 2013). Запись в ВК,2020-11-26,"Лично мне невыносима сама мысль о том, что не дожившие до светлого будущего нашей эры Платон и Сократ, а, возможно, и такие несознательные товарищи, как Шекспир, Бах, Моцарт, Леонардо да Винчи, Караваджо, Верди, Вагнер, Стендаль, Эйнштейн, Антониони и Эдит Пиаф во главе с еще живой Мадонной горят или будут гореть в аду!"
627,https://vk.com/@evgenyponasenkov-1812-god-otvet-istorika-patriarhu-kirillu-10-01-2013?context=author_page_date&ref=author_page,1812 год: ответ историка Патриарху Кириллу (10. 01. 2013). Запись в ВК,2020-11-26,"Как тут не вспомнить выдающегося русского философа Константина Леонтьева, с его знаменитым высказыванием о том, что христианство на Руси еще не было проповедано…"
628,https://vk.com/@evgenyponasenkov-1812-god-otvet-istorika-patriarhu-kirillu-10-01-2013?context=author_page_date&ref=author_page,1812 год: ответ историка Патриарху Кириллу (10. 01. 2013). Запись в ВК,2020-11-26,"Послание: «В память о победе нашего народа над врагом и в благодарность Творцу за Его милости в Храме Христа Спасителя, а также во всех храмах Русской Православной Церкви 8 сентября сего года (26 августа по старому стилю), будет совершено «Молебное пение ко Господу Богу на воспоминание избавления Церкве и Державы Российския от нашествия галлов и с ними двадесяти язык»."
629,https://vk.com/@evgenyponasenkov-1812-god-otvet-istorika-patriarhu-kirillu-10-01-2013?context=author_page_date&ref=author_page,1812 год: ответ историка Патриарху Кириллу (10. 01. 2013). Запись в ВК,2020-11-26,Факты: Рассмотрим сюжет подробнее.
630,https://vk.com/@evgenyponasenkov-1812-god-otvet-istorika-patriarhu-kirillu-10-01-2013?context=author_page_date&ref=author_page,1812 год: ответ историка Патриарху Кириллу (10. 01. 2013). Запись в ВК,2020-11-26,"По моему убеждению, история лучше всего познается через метафору."
631,https://vk.com/@evgenyponasenkov-1812-god-otvet-istorika-patriarhu-kirillu-10-01-2013?context=author_page_date&ref=author_page,1812 год: ответ историка Патриарху Кириллу (10. 01. 2013). Запись в ВК,2020-11-26,Обратимся к истории создания Храма Христа Спасителя.
632,https://vk.com/@evgenyponasenkov-1812-god-otvet-istorika-patriarhu-kirillu-10-01-2013?context=author_page_date&ref=author_page,1812 год: ответ историка Патриарху Кириллу (10. 01. 2013). Запись в ВК,2020-11-26,"По легенде даже само место (с весьма «подходящим» для храма названием «Чертолье») было проклято игуменьей монастыря, который был снесен (!) по приказу царя, чтобы построить очередной памятник идеологического свойства."
633,https://vk.com/@evgenyponasenkov-1812-god-otvet-istorika-patriarhu-kirillu-10-01-2013?context=author_page_date&ref=author_page,1812 год: ответ историка Патриарху Кириллу (10. 01. 2013). Запись в ВК,2020-11-26,Обстоятельства же создания ХХС – череда коррупционных скандалов.
634,https://vk.com/@evgenyponasenkov-1812-god-otvet-istorika-patriarhu-kirillu-10-01-2013?context=author_page_date&ref=author_page,1812 год: ответ историка Патриарху Кириллу (10. 01. 2013). Запись в ВК,2020-11-26,Таланты архитектора и художественный облик постройки весьма образно оценил великий русский художник В. В. Верещагин: выполненный «довольно бездарным архитектором Тоном» проект собора «есть прямое воспроизведение знаменитого Тадж-махала в городе Агра» (Верещагин В.В. На Северной Двине.
635,https://vk.com/@evgenyponasenkov-1812-god-otvet-istorika-patriarhu-kirillu-10-01-2013?context=author_page_date&ref=author_page,1812 год: ответ историка Патриарху Кириллу (10. 01. 2013). Запись в ВК,2020-11-26,По деревянным церквам.
636,https://vk.com/@evgenyponasenkov-1812-god-otvet-istorika-patriarhu-kirillu-10-01-2013?context=author_page_date&ref=author_page,1812 год: ответ историка Патриарху Кириллу (10. 01. 2013). Запись в ВК,2020-11-26,"М., 1896, с. 17)."
637,https://vk.com/@evgenyponasenkov-1812-god-otvet-istorika-patriarhu-kirillu-10-01-2013?context=author_page_date&ref=author_page,1812 год: ответ историка Патриарху Кириллу (10. 01. 2013). Запись в ВК,2020-11-26,"Единоутробный брат актера Алексея Баталова - известный богослов протоиерей Михаил Ардов выразился весьма конкретно: «первый храм на этом месте строил архитектор Тон, а второй храм построил архитектор Моветон»; это «храм Лужка Строителя на водах» (по материалам Википедии и по личным моим свидетельствам общения)."
638,https://vk.com/@evgenyponasenkov-1812-god-otvet-istorika-patriarhu-kirillu-10-01-2013?context=author_page_date&ref=author_page,1812 год: ответ историка Патриарху Кириллу (10. 01. 2013). Запись в ВК,2020-11-26,"Сегодня в рамках большого комплекса ХХС проходят банкеты и концерты, работают магазины…"
639,https://vk.com/@evgenyponasenkov-1812-god-otvet-istorika-patriarhu-kirillu-10-01-2013?context=author_page_date&ref=author_page,1812 год: ответ историка Патриарху Кириллу (10. 01. 2013). Запись в ВК,2020-11-26,Невольно вспоминается русская народная поговорка: «чем ближе к храму – тем дальше от бога».
640,https://vk.com/@evgenyponasenkov-1812-god-otvet-istorika-patriarhu-kirillu-10-01-2013?context=author_page_date&ref=author_page,1812 год: ответ историка Патриарху Кириллу (10. 01. 2013). Запись в ВК,2020-11-26,"Как говорится, «каков поп – таков и приход»: теперь предлагаю поближе рассмотреть «народ-богоносец» в годину 1812-го."
641,https://vk.com/@evgenyponasenkov-1812-god-otvet-istorika-patriarhu-kirillu-10-01-2013?context=author_page_date&ref=author_page,1812 год: ответ историка Патриарху Кириллу (10. 01. 2013). Запись в ВК,2020-11-26,Так определяет знаменитая французская писательница Жермена де Сталь русского крестьянина : «По причине той же необразованности они почти не имеют моральных принципов…»
642,https://vk.com/@evgenyponasenkov-1812-god-otvet-istorika-patriarhu-kirillu-10-01-2013?context=author_page_date&ref=author_page,1812 год: ответ историка Патриарху Кириллу (10. 01. 2013). Запись в ВК,2020-11-26,(де Сталь Ж. Десять лет в изгнании.
643,https://vk.com/@evgenyponasenkov-1812-god-otvet-istorika-patriarhu-kirillu-10-01-2013?context=author_page_date&ref=author_page,1812 год: ответ историка Патриарху Кириллу (10. 01. 2013). Запись в ВК,2020-11-26,"М., 2003, с. 208)."
644,https://vk.com/@evgenyponasenkov-1812-god-otvet-istorika-patriarhu-kirillu-10-01-2013?context=author_page_date&ref=author_page,1812 год: ответ историка Патриарху Кириллу (10. 01. 2013). Запись в ВК,2020-11-26,"И еще: «Одним словом, жители этой империи рассеяны по ее поверхности, и познания одних почти никогда не пригождаются другим. …Православные попы куда менее образованы, чем католические кюре, не говоря уже о протестантских пасторах» (Там же, с. 235)."
645,https://vk.com/@evgenyponasenkov-1812-god-otvet-istorika-patriarhu-kirillu-10-01-2013?context=author_page_date&ref=author_page,1812 год: ответ историка Патриарху Кириллу (10. 01. 2013). Запись в ВК,2020-11-26,"В 1812 году восторжествовал не конфессиональный, а сословный принцип отношения человека к человеку."
646,https://vk.com/@evgenyponasenkov-1812-god-otvet-istorika-patriarhu-kirillu-10-01-2013?context=author_page_date&ref=author_page,1812 год: ответ историка Патриарху Кириллу (10. 01. 2013). Запись в ВК,2020-11-26,"Вот, что, к примеру, вспоминает архимандрит Павел Егоров: «Около Спасских казарм с половины августа множество набралось раненых и увечных солдат."
647,https://vk.com/@evgenyponasenkov-1812-god-otvet-istorika-patriarhu-kirillu-10-01-2013?context=author_page_date&ref=author_page,1812 год: ответ историка Патриарху Кириллу (10. 01. 2013). Запись в ВК,2020-11-26,"Многие их них жаловались и роптали на свое начальство: «Коли здоров солдат, кормят его и одевают, а если заболел – кинули его, как собаку, без всякого призора» (Мельгунов С.П. , Указ. соч., с 207)."
648,https://vk.com/@evgenyponasenkov-1812-god-otvet-istorika-patriarhu-kirillu-10-01-2013?context=author_page_date&ref=author_page,1812 год: ответ историка Патриарху Кириллу (10. 01. 2013). Запись в ВК,2020-11-26,"Не читавшие еще Маркса русские «патриоты-дворяне» уже питали классовое презрение к православным, но незнатным людям."
649,https://vk.com/@evgenyponasenkov-1812-god-otvet-istorika-patriarhu-kirillu-10-01-2013?context=author_page_date&ref=author_page,1812 год: ответ историка Патриарху Кириллу (10. 01. 2013). Запись в ВК,2020-11-26,"Вот, что пишет офицер И.Р. Дрейлинг (кстати, прямой предок Николая Николаевича Дроздова - «Доверенного лица кандидата в президенты»): «3 сентября мы прошли через всю Москву…"
