,url,title,date,text
0,https://vk.com/@evgenyponasenkov-kutuzovskii-plan-kremlya-27-12-2011?context=author_page_date&ref=author_page,Кутузовский план Кремля (27. 12. 2011). Запись в ВК,2021-02-24,"Начну, простите, с конца."
1,https://vk.com/@evgenyponasenkov-kutuzovskii-plan-kremlya-27-12-2011?context=author_page_date&ref=author_page,Кутузовский план Кремля (27. 12. 2011). Запись в ВК,2021-02-24,"Да, митинги 10-го и 24-го декабря – это замечательная веха отечественной истории, да, прежде всего, это дыхание весны и романтики (я вообще вижу в них, прежде всего, художественный смысл), но (не хочу оказаться правым) ОНИ вам ничего не отдадут."
2,https://vk.com/@evgenyponasenkov-kutuzovskii-plan-kremlya-27-12-2011?context=author_page_date&ref=author_page,Кутузовский план Кремля (27. 12. 2011). Запись в ВК,2021-02-24,"У России был один приближенный к серьезному шанс на вменяемое развитие в начале девяностых, но действовавшие тогда поколения допустили две фатальные ошибки: во-первых, не была проведена люстрация (как сделали чехи и поляки) и, во-вторых, вместо выноса архива КГБ (как это сделали с архивом Штази немцы) народ удовольствовался тем, что ему дали поиграть куском металла в виде памятника железному Феликсу, который из-за этих просчетов оказался фениксом."
3,https://vk.com/@evgenyponasenkov-kutuzovskii-plan-kremlya-27-12-2011?context=author_page_date&ref=author_page,Кутузовский план Кремля (27. 12. 2011). Запись в ВК,2021-02-24,"Немного снижая пафос, можно было бы вспомнить и про второй шанс, когда летом 2010 года Кремль исчез в дыму, и все чиновники с охранниками спасали свое здоровье вне кабинетов, но не до шуток нынче…"
4,https://vk.com/@evgenyponasenkov-kutuzovskii-plan-kremlya-27-12-2011?context=author_page_date&ref=author_page,Кутузовский план Кремля (27. 12. 2011). Запись в ВК,2021-02-24,"Собственно на этом я бы и завершил статью, однако есть еще много интересных наблюдений и открытий."
5,https://vk.com/@evgenyponasenkov-kutuzovskii-plan-kremlya-27-12-2011?context=author_page_date&ref=author_page,Кутузовский план Кремля (27. 12. 2011). Запись в ВК,2021-02-24,Какова сейчас тактика Кремля?
6,https://vk.com/@evgenyponasenkov-kutuzovskii-plan-kremlya-27-12-2011?context=author_page_date&ref=author_page,Кутузовский план Кремля (27. 12. 2011). Запись в ВК,2021-02-24,Как автор монографии «Правда о войне 1812 года» я переживаю эффект дежавю.
7,https://vk.com/@evgenyponasenkov-kutuzovskii-plan-kremlya-27-12-2011?context=author_page_date&ref=author_page,Кутузовский план Кремля (27. 12. 2011). Запись в ВК,2021-02-24,"Не вдаваясь в подробности, напомню: Кутузов был хитрым екатерининским вельможей, но слабым военачальником – он проиграл Аустерлиц и Бородино (а потом и Малоярославец), но зато старик прекрасно понимал, что ему больше не надо подставляться: мороз и пространство сделают свое дело (исторической объективности ради должен заметить, что «скифский план» был предложен русскому командованию сначала бывшим маршалом Наполеона Бернадотом, а начинал осуществляться Барклаем – Кутузов лишь продолжил и получил лавры)."
8,https://vk.com/@evgenyponasenkov-kutuzovskii-plan-kremlya-27-12-2011?context=author_page_date&ref=author_page,Кутузовский план Кремля (27. 12. 2011). Запись в ВК,2021-02-24,"Пространство – главный душитель всех политических и личностных движений в России (так захлебывались любые информационные потуги либералов, все крестьянские восстания и т.д.)."
9,https://vk.com/@evgenyponasenkov-kutuzovskii-plan-kremlya-27-12-2011?context=author_page_date&ref=author_page,Кутузовский план Кремля (27. 12. 2011). Запись в ВК,2021-02-24,"В 1812 году многие жители губерний, через которые не прошла узенькая полоска (счет на метры) Смоленского тракта, даже и не знали, что идет война."
10,https://vk.com/@evgenyponasenkov-kutuzovskii-plan-kremlya-27-12-2011?context=author_page_date&ref=author_page,Кутузовский план Кремля (27. 12. 2011). Запись в ВК,2021-02-24,"И про «хранцузов» многие думали, что те есть «бусурмане», а значит, «турки»."
11,https://vk.com/@evgenyponasenkov-kutuzovskii-plan-kremlya-27-12-2011?context=author_page_date&ref=author_page,Кутузовский план Кремля (27. 12. 2011). Запись в ВК,2021-02-24,"И методы оболванивания населения были схожими: пока царь Александр писал красивые и вполне либеральные письма своему «брату» Наполеону (особенно после лобызаний на плоту в 1807 г.), всем попам спустили установку – ругать «Бонапартия» как «антихриста» (которого, кстати, царь для усыпления бдительности наградил высшим орденом империи – орденом Святого Андрея Первозванного), потому как тот уравнял во Франции в правах со всеми остальными «убийц Христа» иудеев."
12,https://vk.com/@evgenyponasenkov-kutuzovskii-plan-kremlya-27-12-2011?context=author_page_date&ref=author_page,Кутузовский план Кремля (27. 12. 2011). Запись в ВК,2021-02-24,"Таким образом, если нет военных талантов (ну, французы талантливее и пушки расставляли, и корпуса водили, да и униформа красивее была), то есть, по-нашему, фактов и реальных достижений в политике и экономике, — то ответим оппозиции эффектами природы, пространства и сладкими увещеваниями («спи, моя радость, усни – в доме погасли огни»)."
13,https://vk.com/@evgenyponasenkov-kutuzovskii-plan-kremlya-27-12-2011?context=author_page_date&ref=author_page,Кутузовский план Кремля (27. 12. 2011). Запись в ВК,2021-02-24,"Бросается в глаза то, что и в 1812 году основная масса населения повела себя индифферентно по отношению к обеим сторонам: в партизанах (организацию которых, кстати, начал Барклай) были всего лишь сотни, а в более многочисленное ополчение помещики отдавали в основном старых и калечных (потому, что помнили, как царь-батюшка их всех «нагрел»: когда в 1806 году Александр просто из клинического самолюбия вновь решил идти войной на Париж, он созвал ополчение (!), но потом ратников владельцам не вернул, а заточил в рекруты)."
14,https://vk.com/@evgenyponasenkov-kutuzovskii-plan-kremlya-27-12-2011?context=author_page_date&ref=author_page,Кутузовский план Кремля (27. 12. 2011). Запись в ВК,2021-02-24,"Поразительно, что за двести лет ни один историк не воскликнул: послушайте, ведь все «полчища» Наполеона могли уместиться на одном большом русском поле (слова Инны Гофф, музыка Яна Френкеля, исполняет Иосиф Кобзон) – и их легко было бы задавить всем «православным миром»!"
15,https://vk.com/@evgenyponasenkov-kutuzovskii-plan-kremlya-27-12-2011?context=author_page_date&ref=author_page,Кутузовский план Кремля (27. 12. 2011). Запись в ВК,2021-02-24,Но нет же!
16,https://vk.com/@evgenyponasenkov-kutuzovskii-plan-kremlya-27-12-2011?context=author_page_date&ref=author_page,Кутузовский план Кремля (27. 12. 2011). Запись в ВК,2021-02-24,Народ остался сидеть по деревням и ждать хитрости Кутузова и романтизма Герцена.
17,https://vk.com/@evgenyponasenkov-kutuzovskii-plan-kremlya-27-12-2011?context=author_page_date&ref=author_page,Кутузовский план Кремля (27. 12. 2011). Запись в ВК,2021-02-24,"Народу было плевать – и на западное слово «патриотизм» (на местном диалекте «дым отечества»), и на «Гражданский кодекс» Наполеона."
18,https://vk.com/@evgenyponasenkov-kutuzovskii-plan-kremlya-27-12-2011?context=author_page_date&ref=author_page,Кутузовский план Кремля (27. 12. 2011). Запись в ВК,2021-02-24,"Населению было плевать (причем, даже неясно, в какую сторону, ведь они же неграмотные – карт читать не умеют) на декабристов (впрочем, как и те – в основном думали о себе: в этом они очень сродни сегодняшней олигархической части митингующих – все есть, но хочется еще и с царем на равных): и, особенно, на их богато одетых жен!"
19,https://vk.com/@evgenyponasenkov-kutuzovskii-plan-kremlya-27-12-2011?context=author_page_date&ref=author_page,Кутузовский план Кремля (27. 12. 2011). Запись в ВК,2021-02-24,"Населению и сейчас плевать – и на митингующих, и на распиливающих."
20,https://vk.com/@evgenyponasenkov-kutuzovskii-plan-kremlya-27-12-2011?context=author_page_date&ref=author_page,Кутузовский план Кремля (27. 12. 2011). Запись в ВК,2021-02-24,Им же для счастья мало надо.
21,https://vk.com/@evgenyponasenkov-kutuzovskii-plan-kremlya-27-12-2011?context=author_page_date&ref=author_page,Кутузовский план Кремля (27. 12. 2011). Запись в ВК,2021-02-24,И пока цена за баррель держится – им это «мало» завсегда кинут на задний двор.
22,https://vk.com/@evgenyponasenkov-kutuzovskii-plan-kremlya-27-12-2011?context=author_page_date&ref=author_page,Кутузовский план Кремля (27. 12. 2011). Запись в ВК,2021-02-24,"Максимум, что население может – это злорадствовать: да как тех скрутил ОМОН, да как этих обозвали на заборе."
23,https://vk.com/@evgenyponasenkov-kutuzovskii-plan-kremlya-27-12-2011?context=author_page_date&ref=author_page,Кутузовский план Кремля (27. 12. 2011). Запись в ВК,2021-02-24,"Обратите внимание: психологи утверждают – первая реакция человека, как правило, искренняя."
24,https://vk.com/@evgenyponasenkov-kutuzovskii-plan-kremlya-27-12-2011?context=author_page_date&ref=author_page,Кутузовский план Кремля (27. 12. 2011). Запись в ВК,2021-02-24,"И первый митинг был жестоко разогнан, а вот потом кремлевские режиссеры смекнули, что лучше дать людям выпустить пар (параллельно с точечной прослушкой, посадкой, ударом по «КоммерсантЪу» и внедрением троянского жирафа) – и спокойно, прикрываясь красивыми обещаниями, дождаться морозов."
25,https://vk.com/@evgenyponasenkov-kutuzovskii-plan-kremlya-27-12-2011?context=author_page_date&ref=author_page,Кутузовский план Кремля (27. 12. 2011). Запись в ВК,2021-02-24,"Они, правда, не рассчитывали, что и 24-го мороз не ударит в полную патриотическую силу (видимо, пояс из Ватопедского монастыря не на их стороне работает – уж как они его лобызали, а все равно он им градусов 20 не додал: не надо было с черного входа на иномарках в русский рай въезжать!)."
26,https://vk.com/@evgenyponasenkov-kutuzovskii-plan-kremlya-27-12-2011?context=author_page_date&ref=author_page,Кутузовский план Кремля (27. 12. 2011). Запись в ВК,2021-02-24,"Я умилялся, слушая, как Рыжков благодарит омоновцев за нежное поведение 10-го (т.е. за то, то они всего лишь не нарушили Конституцию!)."
27,https://vk.com/@evgenyponasenkov-kutuzovskii-plan-kremlya-27-12-2011?context=author_page_date&ref=author_page,Кутузовский план Кремля (27. 12. 2011). Запись в ВК,2021-02-24,Друзья!
28,https://vk.com/@evgenyponasenkov-kutuzovskii-plan-kremlya-27-12-2011?context=author_page_date&ref=author_page,Кутузовский план Кремля (27. 12. 2011). Запись в ВК,2021-02-24,"Это те же, кто вас крутил 31-го каждого месяца и 5-го этого."
29,https://vk.com/@evgenyponasenkov-kutuzovskii-plan-kremlya-27-12-2011?context=author_page_date&ref=author_page,Кутузовский план Кремля (27. 12. 2011). Запись в ВК,2021-02-24,Им просто дали другой приказ (вместе с надбавкой).
30,https://vk.com/@evgenyponasenkov-kutuzovskii-plan-kremlya-27-12-2011?context=author_page_date&ref=author_page,Кутузовский план Кремля (27. 12. 2011). Запись в ВК,2021-02-24,"Нет, вообще, какие они трогательные: Немцов до сих пор живет, как святой, даже не думая, что его могут (а вернее – просто обязаны!) прослушать, а затем – по принципу «разделяй да е..й»."
31,https://vk.com/@evgenyponasenkov-kutuzovskii-plan-kremlya-27-12-2011?context=author_page_date&ref=author_page,Кутузовский план Кремля (27. 12. 2011). Запись в ВК,2021-02-24,"Рыжков вообще вызывает у меня материнские (даже более, нежели отцовские) чувства – такой честный, работящий и верящий."
32,https://vk.com/@evgenyponasenkov-kutuzovskii-plan-kremlya-27-12-2011?context=author_page_date&ref=author_page,Кутузовский план Кремля (27. 12. 2011). Запись в ВК,2021-02-24,Я бы им всем по нимбу роздал.
33,https://vk.com/@evgenyponasenkov-kutuzovskii-plan-kremlya-27-12-2011?context=author_page_date&ref=author_page,Кутузовский план Кремля (27. 12. 2011). Запись в ВК,2021-02-24,А как же?
34,https://vk.com/@evgenyponasenkov-kutuzovskii-plan-kremlya-27-12-2011?context=author_page_date&ref=author_page,Кутузовский план Кремля (27. 12. 2011). Запись в ВК,2021-02-24,"Система устроена так, чтобы не допустить ни одного сколько-нибудь серьезного лидера какой бы то ни было окраски."
35,https://vk.com/@evgenyponasenkov-kutuzovskii-plan-kremlya-27-12-2011?context=author_page_date&ref=author_page,Кутузовский план Кремля (27. 12. 2011). Запись в ВК,2021-02-24,"Правда, «душегубы» немного расслабились и отстали от развития техники – в Интернете появился Навальный."
36,https://vk.com/@evgenyponasenkov-kutuzovskii-plan-kremlya-27-12-2011?context=author_page_date&ref=author_page,Кутузовский план Кремля (27. 12. 2011). Запись в ВК,2021-02-24,"А это очень серьезный и весомый конкурент, который у меня пока вызывает некоторые позитивные эмоции (а уж меня как страстного поклонника Бродского, Лукино Висконти и Уайльда невозможно записать в «националисты»)."
37,https://vk.com/@evgenyponasenkov-kutuzovskii-plan-kremlya-27-12-2011?context=author_page_date&ref=author_page,Кутузовский план Кремля (27. 12. 2011). Запись в ВК,2021-02-24,"Навальный ничем не запятнан (в отличие от ельцинской гвардии), он полон энергии, вполне симпатичен и на нем здорово сидят джинсы."
38,https://vk.com/@evgenyponasenkov-kutuzovskii-plan-kremlya-27-12-2011?context=author_page_date&ref=author_page,Кутузовский план Кремля (27. 12. 2011). Запись в ВК,2021-02-24,"Однако он горячий и неопытный: не совсем с теми начинает ходить на марши, и недостаточно добропорядочные строит выражения лица для фотографов, поэтому его, по всей видимости, сейчас постараются уничтожить (ну, или по статье за разжигание какой-нибудь розни, или просто, как Михоэлса, случайно переедут)."
39,https://vk.com/@evgenyponasenkov-kutuzovskii-plan-kremlya-27-12-2011?context=author_page_date&ref=author_page,Кутузовский план Кремля (27. 12. 2011). Запись в ВК,2021-02-24,"Думаю, подкупать его не станут – он слишком тщеславен: понимает, что без сделок может (в теории) получить больше."
40,https://vk.com/@evgenyponasenkov-kutuzovskii-plan-kremlya-27-12-2011?context=author_page_date&ref=author_page,Кутузовский план Кремля (27. 12. 2011). Запись в ВК,2021-02-24,"При этом еще раньше, чем власть – его уничтожат «свои» же."
41,https://vk.com/@evgenyponasenkov-kutuzovskii-plan-kremlya-27-12-2011?context=author_page_date&ref=author_page,Кутузовский план Кремля (27. 12. 2011). Запись в ВК,2021-02-24,"Я уже начитался омерзительных пасквилей всяких климаксических дур и дураков (мужской климакс часто опаснее дамского), которые ему «не доверяют»."
42,https://vk.com/@evgenyponasenkov-kutuzovskii-plan-kremlya-27-12-2011?context=author_page_date&ref=author_page,Кутузовский план Кремля (27. 12. 2011). Запись в ВК,2021-02-24,"Это самая отвратная часть наших либералов, которые ни себе, ни людям!"
43,https://vk.com/@evgenyponasenkov-kutuzovskii-plan-kremlya-27-12-2011?context=author_page_date&ref=author_page,Кутузовский план Кремля (27. 12. 2011). Запись в ВК,2021-02-24,Они привыкли сидеть в подвалах и исподтишка вякать на жуликов и воров.
44,https://vk.com/@evgenyponasenkov-kutuzovskii-plan-kremlya-27-12-2011?context=author_page_date&ref=author_page,Кутузовский план Кремля (27. 12. 2011). Запись в ВК,2021-02-24,Но они патологически не хотят сами встать у власти.
45,https://vk.com/@evgenyponasenkov-kutuzovskii-plan-kremlya-27-12-2011?context=author_page_date&ref=author_page,Кутузовский план Кремля (27. 12. 2011). Запись в ВК,2021-02-24,И как только появился реальный молодой парень с будущим – они всем миром стали его топить.
46,https://vk.com/@evgenyponasenkov-kutuzovskii-plan-kremlya-27-12-2011?context=author_page_date&ref=author_page,Кутузовский план Кремля (27. 12. 2011). Запись в ВК,2021-02-24,С такими «друзьями» и Кремля не надо.
47,https://vk.com/@evgenyponasenkov-kutuzovskii-plan-kremlya-27-12-2011?context=author_page_date&ref=author_page,Кутузовский план Кремля (27. 12. 2011). Запись в ВК,2021-02-24,"Да, ребята, не бойтесь: с сатрапами надо бороться по мере их поступления."
48,https://vk.com/@evgenyponasenkov-kutuzovskii-plan-kremlya-27-12-2011?context=author_page_date&ref=author_page,Кутузовский план Кремля (27. 12. 2011). Запись в ВК,2021-02-24,Если Навальный по ходу успехов захочет превратиться в такого – вы и ему устроите проспект Сахарова.
49,https://vk.com/@evgenyponasenkov-kutuzovskii-plan-kremlya-27-12-2011?context=author_page_date&ref=author_page,Кутузовский план Кремля (27. 12. 2011). Запись в ВК,2021-02-24,"Вы же поймите: ученые доказали, что сегодня все политические процессы идут быстрее – если советскому фашизму потребовалось 70 лет, чтобы сгнить до основания, а немецкому 12, чтобы его разгромили извне, то в наши дни счет идет на месяцы."
50,https://vk.com/@evgenyponasenkov-kutuzovskii-plan-kremlya-27-12-2011?context=author_page_date&ref=author_page,Кутузовский план Кремля (27. 12. 2011). Запись в ВК,2021-02-24,Дайте хоть какого-то развития сценического действия – а то скучно!
51,https://vk.com/@evgenyponasenkov-kutuzovskii-plan-kremlya-27-12-2011?context=author_page_date&ref=author_page,Кутузовский план Кремля (27. 12. 2011). Запись в ВК,2021-02-24,"Вот ведь даже главный драматург и режиссер всея Руси, Владислав Юрьевич,– и тот нам всем постоянно какие-то мизансцены, а то и спектакли с барского плеча подкидывает."
52,https://vk.com/@evgenyponasenkov-kutuzovskii-plan-kremlya-27-12-2011?context=author_page_date&ref=author_page,Кутузовский план Кремля (27. 12. 2011). Запись в ВК,2021-02-24,"Вот уже и олигарха, метящего в президенты, по главным каналам пиарят (а тот, конечно, втайне от сценариста мечтает, что потом перехватит инициативу…), и ответственный за экономику при Путине на митинге против режима выступает."
